{
  "$schema": "./registry.schema.json",
  "schemaVersion": "1.0.0",
  "package": "@vllnt/ui-native",
  "channel": "canary",
  "status": "experimental",
  "availability": "source",
  "minimumReact": "19.0.0",
  "minimumReactNative": "0.81.0",
  "installation": {
    "available": false,
    "command": "pnpm add @vllnt/ui-native@canary",
    "reason": "Only a manually bootstrapped pre-release exists on npm; it has no build provenance and is not a supported install. The first workflow-built synchronized canary has not been published."
  },
  "peerDependencies": {
    "react": ">=19.0.0 <20",
    "react-native": ">=0.81.0 <1"
  },
  "components": [
    {
      "name": "accordion",
      "compatibility": "native-adapted",
      "source": "src/components/accordion/accordion.tsx"
    },
    {
      "name": "activity-log",
      "compatibility": "native-adapted",
      "source": "src/components/activity-log/activity-log.tsx"
    },
    {
      "name": "agent-activity",
      "compatibility": "native-adapted",
      "source": "src/components/agent-activity/agent-activity.tsx"
    },
    {
      "name": "ai-artifact",
      "compatibility": "native-adapted",
      "source": "src/components/ai-artifact/ai-artifact.tsx"
    },
    {
      "name": "ai-chat-input",
      "compatibility": "native-adapted",
      "source": "src/components/ai-chat-input/ai-chat-input.tsx"
    },
    {
      "name": "ai-message-bubble",
      "compatibility": "native-adapted",
      "source": "src/components/ai-message-bubble/ai-message-bubble.tsx"
    },
    {
      "name": "ai-source-citation",
      "compatibility": "native-adapted",
      "source": "src/components/ai-source-citation/ai-source-citation.tsx"
    },
    {
      "name": "ai-streaming-text",
      "compatibility": "native-adapted",
      "source": "src/components/ai-streaming-text/ai-streaming-text.tsx"
    },
    {
      "name": "ai-tool-call-display",
      "compatibility": "native-adapted",
      "source": "src/components/ai-tool-call-display/ai-tool-call-display.tsx"
    },
    {
      "name": "alert",
      "compatibility": "native-adapted",
      "source": "src/components/alert/alert.tsx"
    },
    {
      "name": "alert-dialog",
      "compatibility": "native-adapted",
      "source": "src/components/alert-dialog/alert-dialog.tsx"
    },
    {
      "name": "animated-list",
      "compatibility": "native-adapted",
      "source": "src/components/animated-list/animated-list.tsx"
    },
    {
      "name": "animated-tabs",
      "compatibility": "native-adapted",
      "source": "src/components/animated-tabs/animated-tabs.tsx"
    },
    {
      "name": "animated-testimonials",
      "compatibility": "native-adapted",
      "source": "src/components/animated-testimonials/animated-testimonials.tsx"
    },
    {
      "name": "animated-text",
      "compatibility": "native-adapted",
      "source": "src/components/animated-text/animated-text.tsx"
    },
    {
      "name": "aspect-ratio",
      "compatibility": "native-adapted",
      "source": "src/components/aspect-ratio/aspect-ratio.tsx"
    },
    {
      "name": "avatar",
      "compatibility": "native-adapted",
      "source": "src/components/avatar/avatar.tsx"
    },
    {
      "name": "avatar-group",
      "compatibility": "native-adapted",
      "source": "src/components/avatar-group/avatar-group.tsx"
    },
    {
      "name": "badge",
      "compatibility": "portable-options",
      "source": "src/components/badge/badge.tsx"
    },
    {
      "name": "banner",
      "compatibility": "native-adapted",
      "source": "src/components/banner/banner.tsx"
    },
    {
      "name": "blur-reveal",
      "compatibility": "native-adapted",
      "source": "src/components/blur-reveal/blur-reveal.tsx"
    },
    {
      "name": "bottom-bar",
      "compatibility": "native-adapted",
      "source": "src/components/bottom-bar/bottom-bar.tsx"
    },
    {
      "name": "breadcrumb",
      "compatibility": "native-adapted",
      "source": "src/components/breadcrumb/breadcrumb.tsx"
    },
    {
      "name": "button",
      "compatibility": "portable-options",
      "source": "src/components/button/button.tsx"
    },
    {
      "name": "button-group",
      "compatibility": "native-adapted",
      "source": "src/components/button-group/button-group.tsx"
    },
    {
      "name": "calendar",
      "compatibility": "native-adapted",
      "source": "src/components/calendar/calendar.tsx"
    },
    {
      "name": "callout",
      "compatibility": "native-adapted",
      "source": "src/components/callout/callout.tsx"
    },
    {
      "name": "card",
      "compatibility": "portable-options",
      "source": "src/components/card/card.tsx"
    },
    {
      "name": "carousel",
      "compatibility": "native-adapted",
      "source": "src/components/carousel/carousel.tsx"
    },
    {
      "name": "category-filter",
      "compatibility": "native-adapted",
      "source": "src/components/category-filter/category-filter.tsx"
    },
    {
      "name": "chain-of-thought",
      "compatibility": "native-adapted",
      "source": "src/components/chain-of-thought/chain-of-thought.tsx"
    },
    {
      "name": "checkbox",
      "compatibility": "native-adapted",
      "source": "src/components/checkbox/checkbox.tsx"
    },
    {
      "name": "checkbox-group",
      "compatibility": "native-adapted",
      "source": "src/components/checkbox-group/checkbox-group.tsx"
    },
    {
      "name": "checklist",
      "compatibility": "native-adapted",
      "source": "src/components/checklist/checklist.tsx"
    },
    {
      "name": "code-block",
      "compatibility": "native-adapted",
      "source": "src/components/code-block/code-block.tsx"
    },
    {
      "name": "collapsible",
      "compatibility": "native-adapted",
      "source": "src/components/collapsible/collapsible.tsx"
    },
    {
      "name": "color-picker",
      "compatibility": "native-adapted",
      "source": "src/components/color-picker/color-picker.tsx"
    },
    {
      "name": "combobox",
      "compatibility": "native-adapted",
      "source": "src/components/combobox/combobox.tsx"
    },
    {
      "name": "command",
      "compatibility": "native-adapted",
      "source": "src/components/command/command.tsx"
    },
    {
      "name": "completion-dialog",
      "compatibility": "native-adapted",
      "source": "src/components/completion-dialog/completion-dialog.tsx"
    },
    {
      "name": "content-intro",
      "compatibility": "native-adapted",
      "source": "src/components/content-intro/content-intro.tsx"
    },
    {
      "name": "context-menu",
      "compatibility": "native-adapted",
      "source": "src/components/context-menu/context-menu.tsx"
    },
    {
      "name": "conversation-thread",
      "compatibility": "native-adapted",
      "source": "src/components/conversation-thread/conversation-thread.tsx"
    },
    {
      "name": "copy-button",
      "compatibility": "native-adapted",
      "source": "src/components/copy-button/copy-button.tsx"
    },
    {
      "name": "countdown-timer",
      "compatibility": "native-adapted",
      "source": "src/components/countdown-timer/countdown-timer.tsx"
    },
    {
      "name": "credit-badge",
      "compatibility": "native-adapted",
      "source": "src/components/credit-badge/credit-badge.tsx"
    },
    {
      "name": "data-list",
      "compatibility": "native-adapted",
      "source": "src/components/data-list/data-list.tsx"
    },
    {
      "name": "date-field",
      "compatibility": "native-adapted",
      "source": "src/components/date-field/date-field.tsx"
    },
    {
      "name": "date-picker",
      "compatibility": "native-adapted",
      "source": "src/components/date-picker/date-picker.tsx"
    },
    {
      "name": "date-range-picker",
      "compatibility": "native-adapted",
      "source": "src/components/date-range-picker/date-range-picker.tsx"
    },
    {
      "name": "dialog",
      "compatibility": "native-adapted",
      "source": "src/components/dialog/dialog.tsx"
    },
    {
      "name": "document-sibling-nav",
      "compatibility": "native-adapted",
      "source": "src/components/document-sibling-nav/document-sibling-nav.tsx"
    },
    {
      "name": "drawer",
      "compatibility": "native-adapted",
      "source": "src/components/drawer/drawer.tsx"
    },
    {
      "name": "dropdown-menu",
      "compatibility": "native-adapted",
      "source": "src/components/dropdown-menu/dropdown-menu.tsx"
    },
    {
      "name": "empty-state",
      "compatibility": "native-adapted",
      "source": "src/components/empty-state/empty-state.tsx"
    },
    {
      "name": "exercise",
      "compatibility": "native-adapted",
      "source": "src/components/exercise/exercise.tsx"
    },
    {
      "name": "expandable-cards",
      "compatibility": "native-adapted",
      "source": "src/components/expandable-cards/expandable-cards.tsx"
    },
    {
      "name": "faq",
      "compatibility": "native-adapted",
      "source": "src/components/faq/faq.tsx"
    },
    {
      "name": "field",
      "compatibility": "native-adapted",
      "source": "src/components/field/field.tsx"
    },
    {
      "name": "fieldset",
      "compatibility": "native-adapted",
      "source": "src/components/fieldset/fieldset.tsx"
    },
    {
      "name": "file-upload",
      "compatibility": "native-adapted",
      "source": "src/components/file-upload/file-upload.tsx"
    },
    {
      "name": "filter-bar",
      "compatibility": "native-adapted",
      "source": "src/components/filter-bar/filter-bar.tsx"
    },
    {
      "name": "flashcard",
      "compatibility": "native-adapted",
      "source": "src/components/flashcard/flashcard.tsx"
    },
    {
      "name": "floating-action-button",
      "compatibility": "native-adapted",
      "source": "src/components/floating-action-button/floating-action-button.tsx"
    },
    {
      "name": "floating-toolbar",